{
  "schema_version": "1.0.0",
  "dataset_id": "vbot-rag-v2",
  "dataset_version": "2.0.0-dev.5",
  "dataset_fingerprint_sha256": "8ee20cdad3bf0f1dfc0bfe0e89e868b4d38c72481feda6cd0151b581d61581d6",
  "corpus_id": "vbot-public-safe",
  "corpus_version": "1.0.0",
  "corpus_fingerprint_sha256": "dff71736dde3ab944cf55400a02707f802702a7f6a265b5b47e24fe8a677f4fe",
  "evidence_catalog_sha256": "c15148e0aa42d867edbb6698c1b6f112f8767f557a8fdc172f497d90f4edf326",
  "summary": {
    "documents": 3,
    "evidence_blocks": 99,
    "headings": 19,
    "headings_with_current_cases": 19,
    "cases": 162,
    "approved_cases": 162,
    "span_labelled_answerable_cases": 128,
    "target_lanes": 15,
    "lanes_with_approved_seed": 15,
    "provisional_total_seed_gap": 0
  },
  "documents": [
    {
      "document_id": "backbone-findings",
      "status": "active",
      "access_class": "public",
      "evidence_blocks": 11,
      "block_types": {
        "heading": 2,
        "list": 8,
        "prose": 1
      },
      "headings": [
        {
          "heading_key": "backbone-findings::dpo-findings-2026-07-09-run-20260709-210645-dpo-1-5b-sft-merged-fresh-lora",
          "heading_path": [
            "DPO findings (2026-07-09, run 20260709-210645-dpo, 1.5B SFT-merged + fresh LoRA)"
          ],
          "evidence_blocks": 6,
          "block_types": {
            "heading": 1,
            "list": 4,
            "prose": 1
          },
          "linked_case_ids": [
            "v1-q34",
            "v1-q35",
            "v2-d017",
            "v2-d021",
            "v2-d030",
            "v2-d039",
            "v2-d046",
            "v2-d051",
            "v2a-ai-006",
            "v2a-ai-008",
            "v2r-ai-030",
            "v2r-ai-031",
            "v2r-ai-032",
            "v2r-ai-033",
            "v2r-ai-034"
          ],
          "approved_case_ids": [
            "v1-q34",
            "v1-q35",
            "v2-d017",
            "v2-d021",
            "v2-d030",
            "v2-d039",
            "v2-d046",
            "v2-d051",
            "v2a-ai-006",
            "v2a-ai-008",
            "v2r-ai-030",
            "v2r-ai-031",
            "v2r-ai-032",
            "v2r-ai-033",
            "v2r-ai-034"
          ],
          "span_labelled_case_ids": [
            "v1-q34",
            "v1-q35",
            "v2-d017",
            "v2-d021",
            "v2-d030",
            "v2-d039",
            "v2-d046",
            "v2-d051",
            "v2a-ai-006",
            "v2a-ai-008",
            "v2r-ai-030",
            "v2r-ai-031",
            "v2r-ai-032",
            "v2r-ai-033",
            "v2r-ai-034"
          ],
          "has_current_case": true
        },
        {
          "heading_key": "backbone-findings::sweep-findings-2026-07-09-1-5b-fixed-eff-batch-16",
          "heading_path": [
            "Sweep findings (2026-07-09, 1.5B, fixed eff. batch 16)"
          ],
          "evidence_blocks": 5,
          "block_types": {
            "heading": 1,
            "list": 4
          },
          "linked_case_ids": [
            "v1-q32",
            "v1-q33",
            "v2-d019",
            "v2-d045",
            "v2-d051",
            "v2a-ai-005",
            "v2r-ai-026",
            "v2r-ai-027",
            "v2r-ai-028",
            "v2r-ai-029"
          ],
          "approved_case_ids": [
            "v1-q32",
            "v1-q33",
            "v2-d019",
            "v2-d045",
            "v2-d051",
            "v2a-ai-005",
            "v2r-ai-026",
            "v2r-ai-027",
            "v2r-ai-028",
            "v2r-ai-029"
          ],
          "span_labelled_case_ids": [
            "v1-q32",
            "v1-q33",
            "v2-d019",
            "v2-d045",
            "v2-d051",
            "v2a-ai-005",
            "v2r-ai-026",
            "v2r-ai-027",
            "v2r-ai-028",
            "v2r-ai-029"
          ],
          "has_current_case": true
        }
      ],
      "headings_total": 2,
      "headings_with_current_cases": 2,
      "headings_without_current_cases": []
    },
    {
      "document_id": "backbone-plan",
      "status": "active",
      "access_class": "public",
      "evidence_blocks": 35,
      "block_types": {
        "heading": 8,
        "list": 23,
        "prose": 3,
        "table": 1
      },
      "headings": [
        {
          "heading_key": "backbone-plan::behavior-families-dataset-lanes",
          "heading_path": [
            "FT-Lab — \"Backbone\" Fine-Tune Plan",
            "Behavior families (dataset lanes)"
          ],
          "evidence_blocks": 3,
          "block_types": {
            "heading": 1,
            "prose": 1,
            "table": 1
          },
          "linked_case_ids": [
            "v1-q28"
          ],
          "approved_case_ids": [
            "v1-q28"
          ],
          "span_labelled_case_ids": [
            "v1-q28"
          ],
          "has_current_case": true
        },
        {
          "heading_key": "backbone-plan::dataset-spec",
          "heading_path": [
            "FT-Lab — \"Backbone\" Fine-Tune Plan",
            "Dataset spec"
          ],
          "evidence_blocks": 7,
          "block_types": {
            "heading": 1,
            "list": 6
          },
          "linked_case_ids": [
            "v1-q29",
            "v2-d011",
            "v2-d015",
            "v2r-ai-003",
            "v2r-ai-014",
            "v2r-ai-015",
            "v2r-ai-016",
            "v2r-ai-017"
          ],
          "approved_case_ids": [
            "v1-q29",
            "v2-d011",
            "v2-d015",
            "v2r-ai-003",
            "v2r-ai-014",
            "v2r-ai-015",
            "v2r-ai-016",
            "v2r-ai-017"
          ],
          "span_labelled_case_ids": [
            "v1-q29",
            "v2-d011",
            "v2-d015",
            "v2r-ai-003",
            "v2r-ai-014",
            "v2r-ai-015",
            "v2r-ai-016",
            "v2r-ai-017"
          ],
          "has_current_case": true
        },
        {
          "heading_key": "backbone-plan::evaluation-the-credibility-section",
          "heading_path": [
            "FT-Lab — \"Backbone\" Fine-Tune Plan",
            "Evaluation (the credibility section)"
          ],
          "evidence_blocks": 6,
          "block_types": {
            "heading": 1,
            "list": 5
          },
          "linked_case_ids": [
            "v2-d001",
            "v2-d010",
            "v2-d012",
            "v2-d016",
            "v2-d018",
            "v2-d051",
            "v2r-ai-022"
          ],
          "approved_case_ids": [
            "v2-d001",
            "v2-d010",
            "v2-d012",
            "v2-d016",
            "v2-d018",
            "v2-d051",
            "v2r-ai-022"
          ],
          "span_labelled_case_ids": [
            "v2-d001",
            "v2-d010",
            "v2-d012",
            "v2-d016",
            "v2-d018",
            "v2-d051",
            "v2r-ai-022"
          ],
          "has_current_case": true
        },
        {
          "heading_key": "backbone-plan::ft-lab-backbone-fine-tune-plan",
          "heading_path": [
            "FT-Lab — \"Backbone\" Fine-Tune Plan"
          ],
          "evidence_blocks": 3,
          "block_types": {
            "heading": 1,
            "prose": 2
          },
          "linked_case_ids": [
            "v1-q27",
            "v2-d010",
            "v2r-ai-013",
            "v2r-ai-041"
          ],
          "approved_case_ids": [
            "v1-q27",
            "v2-d010",
            "v2r-ai-013",
            "v2r-ai-041"
          ],
          "span_labelled_case_ids": [
            "v1-q27",
            "v2-d010",
            "v2r-ai-013",
            "v2r-ai-041"
          ],
          "has_current_case": true
        },
        {
          "heading_key": "backbone-plan::ship-list",
          "heading_path": [
            "FT-Lab — \"Backbone\" Fine-Tune Plan",
            "Ship list"
          ],
          "evidence_blocks": 5,
          "block_types": {
            "heading": 1,
            "list": 4
          },
          "linked_case_ids": [
            "v1-q36",
            "v2-d013",
            "v2-d014",
            "v2-d050",
            "v2a-ai-004",
            "v2r-ai-023",
            "v2r-ai-024"
          ],
          "approved_case_ids": [
            "v1-q36",
            "v2-d013",
            "v2-d014",
            "v2-d050",
            "v2a-ai-004",
            "v2r-ai-023",
            "v2r-ai-024"
          ],
          "span_labelled_case_ids": [
            "v1-q36",
            "v2-d013",
            "v2-d014",
            "v2-d050",
            "v2a-ai-004",
            "v2r-ai-023",
            "v2r-ai-024"
          ],
          "has_current_case": true
        },
        {
          "heading_key": "backbone-plan::status",
          "heading_path": [
            "FT-Lab — \"Backbone\" Fine-Tune Plan",
            "Status"
          ],
          "evidence_blocks": 2,
          "block_types": {
            "heading": 1,
            "list": 1
          },
          "linked_case_ids": [
            "v2-d002",
            "v2r-ai-025"
          ],
          "approved_case_ids": [
            "v2-d002",
            "v2r-ai-025"
          ],
          "span_labelled_case_ids": [
            "v2-d002",
            "v2r-ai-025"
          ],
          "has_current_case": true
        },
        {
          "heading_key": "backbone-plan::training",
          "heading_path": [
            "FT-Lab — \"Backbone\" Fine-Tune Plan",
            "Training"
          ],
          "evidence_blocks": 5,
          "block_types": {
            "heading": 1,
            "list": 4
          },
          "linked_case_ids": [
            "v1-q30",
            "v1-q31",
            "v2-d008",
            "v2-d013",
            "v2-d040",
            "v2a-ai-004",
            "v2r-ai-018",
            "v2r-ai-019",